{"zeena":[
"[13/05/2017, 22:19:16] Remco: Finaly I understand that I don't understand quantum mechanics ...",
"â€[11/06/2017, 23:19:46] Remco: â€<attached: 00029327-AUDIO-2017-06-11-23-19-46.opus>",
"â€[13/07/2017, 22:46:44] Remco: â€<attached: 00051647-GIF-2017-07-13-22-46-43.mp4>",
"â€[23/07/2017, 23:16:38] Remco: â€<attached: 00065558-PHOTO-2017-07-23-23-16-38.jpg>",
"[28/08/2017, 20:37:50] Zeena: Volgende x",
"[13/11/2017, 23:34:27] Zeena: Ok",
"[25/11/2017, 20:23:49] Remco: Als je tijdens je kuur zeker weet dat er gyno ontstaat, of groeit, begin dan z.s.m. met tamoxifen. 20-40 mg ED voor enkele dagen, gevolgd door 10 mg ED. Met 40 mg accumuleren de actieve metabolieten van tamoxifen sneller, na 1 dag zit het namelijk nog lang niet op een steady-state. Meer dan 20 mg is dus niet per definitie zinloos zoals hier vaak geroepen wordt (al is het alleen al omdat het competitief bindt aan de oestrogeen receptor en dus ook afhankelijk is van hoeveel circulerend oestradiol er aanwezig is). Tamoxifen heeft zich veelvuldig bewezen in klinische studies en werkt vrij snel in dit soort gevallen is de ervaring.",
"",
"Als je uit het verleden weet dat je als een malle gyno krijgt zodra je gaat kuren, slik dan preventief een aromatase remmer, bij voorkeur exemestaan (aromasin).",
"",
"Over 'prolactine gyno' kan ik heel kort zijn; trenbolon en andere sterke androgenen laten prolactine DALEN, en prolactine ansich gaat GEEN gyno veroorzaken. Bij hyperprolactinemie ontstaat de gyno dan ook niet door prolactine, maar secundair aan de hypogonadisme die kan ontstaan (lees: verlaagde androgene : oestrogene ratio, DIT is namelijk hetgeen wat gyno veroorzaakt). Bovendien laten sterke androgenen het klierweefsel van de borst slinken. Mind you; na verloop van tijd wordt overmatig klierweefsel van gyno bindweefsel, dit bindweefsel is NIET gevoelig voor endocriene therapie.",
"[11/04/2018, 17:52:50] Zeena: Mee toe",
"â€[28/12/2018, 16:21:06] Zeena: â€<attached: 00441290-STICKER-2018-12-28-16-21-06.webp>",
"â€[28/12/2018, 16:21:07] Zeena: â€<attached: 00441291-STICKER-2018-12-28-16-21-07.webp>",
"â€[08/09/2019, 11:10:38] Zeena: â€<attached: 00567504-PHOTO-2019-09-08-11-10-38.jpg>",
"[08/09/2019, 11:23:08] Remco: Aah goei",
"[10/09/2019, 18:01:08] Zeena: Vandaag Apple event",
"[10/09/2019, 18:01:15] Zeena: Wel benieuwd met wat ze zullen komen",
"[10/09/2019, 18:01:36] Remco: Interesseert me echt helemaal niks",
"[10/09/2019, 18:01:44] Remco: Komt toch niks vernieuwends",
"[10/09/2019, 18:02:17] Zeena: O-oke sorryğŸ¥º",
"[10/09/2019, 19:43:42] Remco: Ik stuur je g wel op deze week ok? aangezien vince niet meer naar sander komt vrijdag",
"[10/09/2019, 19:49:17] Zeena: Ooh oke",
"[10/09/2019, 19:49:22] Zeena: Ja is goed",
"[10/09/2019, 19:49:34] Zeena: Je weet â€˜t adres ğŸ¤ª",
"[10/09/2019, 19:49:41] Zeena: Laat maar weten wnr precies",
"[10/09/2019, 19:50:36] Remco: Ja kijk morgen op werk ff of ik klein doosje heb maar zeg dan wel",
"[10/09/2019, 19:59:15] Zeena: ğŸ‘ŒğŸ¼",
"[11/09/2019, 10:08:33] Zeena: Hahahahahahaha",
"[11/09/2019, 10:08:34] Zeena: Remco",
"[11/09/2019, 10:08:38] Zeena: https://www.facebook.com/100000013099962/posts/2834641806546228?sfns=mo",
"â€[11/09/2019, 10:08:42] Zeena: â€<attached: 00567623-STICKER-2019-09-11-10-08-42.webp>",
"[11/09/2019, 10:33:35] Remco: Ja ik zag het",
"[11/09/2019, 10:33:38] Remco: Dikke kk mongool",
"[11/09/2019, 10:34:20] Zeena: ğŸ˜‚",
"[11/09/2019, 10:34:23] Zeena: Ging stuk lol",
"[11/09/2019, 10:34:40] Remco: Vond al rare gozer",
"[11/09/2019, 10:43:15] Zeena: Ja iszo man",
"[11/09/2019, 18:12:56] Remco: Heb g verstuurd",
"[11/09/2019, 18:29:47] Zeena: TopğŸ¥³",
"[11/09/2019, 18:29:55] Zeena: Dan zie ik â€˜t wel verschijnen",
"â€[17/09/2019, 09:55:45] Zeena: â€<attached: 00568088-PHOTO-2019-09-17-09-55-45.jpg>",
"[17/09/2019, 09:59:48] Remco: Jelly",
"[17/09/2019, 10:00:03] Zeena: Je hebt nog tijd tot 30 sept",
"[17/09/2019, 10:00:14] Remco: Heb toch al 3x gezegd dat het niet werkt",
"[17/09/2019, 10:00:26] Zeena: Moet toch iets zijn waardoor het niet werkt ğŸ˜›",
"[17/09/2019, 10:04:33] Remco: Ja ik krijg geen sms",
"[17/09/2019, 10:05:00] Zeena: Probeer ander nr dan",
"[17/09/2019, 10:05:18] Zeena: Beetje moeite maar dan heb je wel 100â‚¬ ğŸ˜›",
"[17/09/2019, 10:09:47] Remco: Heb jij een ander nummer dan",
"[17/09/2019, 10:10:09] Zeena: Neu maar je kan wel bij de lokale reparateur van lebara halen oid toch",
"[17/09/2019, 10:10:45] Remco: Hm",
"[17/09/2019, 10:10:47] Remco: Kan ik dat niet bestellen",
"[17/09/2019, 10:10:56] Zeena: Jawel, had je ook gedaan rememeber",
"[17/09/2019, 10:11:22] Remco: Oja",
"[17/09/2019, 10:11:23] Remco: Nou gedaan",
"[17/09/2019, 10:11:26] Remco: Hopelijk werkt het nu wel een keer",
"[17/09/2019, 10:11:29] Zeena: Whoo",
"[17/09/2019, 10:11:55] Zeena: Kreeg je de eerste sms niet of de tweede niet?",
"[17/09/2019, 10:12:00] Zeena: Want ik kreeg de tweede ook niet",
"[17/09/2019, 10:24:35] Remco: Nee helemaal niks",
"[17/09/2019, 10:28:34] Zeena: En je hebt +316 gedaan?",
"[17/09/2019, 10:37:27] Remco: Letterlijk elke combinatie geprobeerd",
"[17/09/2019, 10:42:13] Zeena: Hmm heel apart",
"[18/09/2019, 19:18:48] Remco: Hoe lang duurde tot jij ww kreeg van beleg ding",
"[18/09/2019, 19:19:09] Zeena: Nou dat duurde ff want mâ€™n paspoort was niet goedgekeurd",
"[18/09/2019, 19:19:17] Zeena: Moest in kleur ik had in zwart wit",
"[18/09/2019, 19:19:25] Zeena: Maar in principe paar uur nadat ik â€˜t had verstuurd",
"[18/09/2019, 19:19:30] Remco: Ooh goei",
"[18/09/2019, 19:19:38] Remco: Ik heb wel in kleur dus zal wel snel",
"[18/09/2019, 19:20:14] Zeena: Eerste sms binnen dus?",
"[18/09/2019, 19:20:25] Remco: Met Lebara instNt",
"[18/09/2019, 19:20:32] Zeena: GoeiğŸ‘ŒğŸ¼ğŸ‘ŒğŸ¼",
"[18/09/2019, 19:20:35] Zeena: Gains",
"[18/09/2019, 19:20:45] Remco: Hoeveel had jij over gemaakt voor je ww",
"[18/09/2019, 19:20:49] Remco: Ik heb 2 cent gedaan",
"[18/09/2019, 19:20:53] Zeena: â‚¬5",
"[18/09/2019, 19:21:02] Remco: Dat las ik later in guide idd",
"[18/09/2019, 19:21:11] Remco: Maae de site zelf zei alles na 1 cent is instant ofzo",
"[18/09/2019, 19:21:15] Zeena: Ja klopt",
"[18/09/2019, 19:21:19] Remco: Ik dacht is net als Paypal",
"[18/09/2019, 19:21:19] Zeena: Kaar je moet een aandeel kopen",
"[18/09/2019, 19:21:26] Remco: Dat je moet overmaken om te laten zien",
"[18/09/2019, 19:21:26] Remco: Ooh",
"[18/09/2019, 19:21:28] Zeena: Dus daarom gelijk wat meer gedaan",
"[18/09/2019, 19:21:31] Zeena: Dan hoeft â€˜t niet nog eens",
"[18/09/2019, 19:22:49] Remco: Done nu",
"[18/09/2019, 19:23:08] Zeena: Goed, gaat vast wel lukken binnen paar dagen",
"[19/09/2019, 21:03:28] Zeena: https://nl.pepper.com/aanbiedingen/gratis-dagpas-fit-for-free-114780",
"[23/09/2019, 09:06:30] Zeena: Zou jij me vandaag misschien kunnen helpen vertellen hoe ik mâ€™n mela moet klaarmaken?ğŸ¥º",
"[23/09/2019, 09:20:52] Remco: Heb je dat dan",
"[23/09/2019, 09:21:08] Zeena: Ja heb nog nieuwe",
"[23/09/2019, 09:21:18] Zeena: Kan ook de oude gebruiken maar durf niet ğŸ˜‚ğŸ¥º",
"[23/09/2019, 09:21:24] Zeena: Jij zou wel hebben gedaan he?",
"[23/09/2019, 09:21:37] Remco: Ik gebruik mijn overrating al ran lang ja",
"[23/09/2019, 09:21:50] Remco: Marja als je bacwater syringe en naald hebt dan kan je nieuwe maken",
"[23/09/2019, 09:21:54] Remco: Over datum",
"[23/09/2019, 09:22:18] Zeena: Aan de ene kant durf ik niet aan de andere kant denk ik er zijn mensen die minder steriel bezig zijn hahahah",
"[23/09/2019, 09:22:23] Zeena: Dus hoe erg kan â€˜t zijn",
"[23/09/2019, 09:27:55] Remco: Zelf weten",
"[23/09/2019, 09:27:57] Remco: Kost geen drol",
"[23/09/2019, 09:28:14] Zeena: Oh ja dar weet ik niet eigenlijk haha",
"[23/09/2019, 09:28:21] Zeena: Van Leroy zn site had je â€˜t toch?",
"[23/09/2019, 09:29:19] Zeena: Oh zie â€˜t",
"[23/09/2019, 09:29:27] Zeena: Nou dan liever geen risico nemen en nieuwe doen ja",
"[23/09/2019, 09:40:16] Remco: je hebt toch nieuwe",
"[23/09/2019, 09:40:58] Zeena: Klopt",
"[23/09/2019, 09:41:02] Zeena: Dus doe dat wel gewoon haha",
"[23/09/2019, 09:41:08] Zeena: Moet kijken of ik nog bac water heb",
"[23/09/2019, 09:43:51] Remco: Anders 2ml van leon vragen",
"[23/09/2019, 09:50:31] Zeena: Heb â€˜t zie ik",
"[23/09/2019, 09:50:43] Zeena: En 2 lege vials nog",
"[23/09/2019, 09:54:38] Remco: Ja opzich niet nodig",
"[23/09/2019, 09:54:47] Remco: 1ml vloeistof of 2ml als het past in die mt2 spuiten en thats it",
"[23/09/2019, 09:54:54] Remco: via de zijkant van vial spuiten en niet direct op de mt2",
"[23/09/2019, 10:04:06] Zeena: Sinds wanneer ben je zo laks ğŸ˜›",
"[23/09/2019, 10:04:18] Zeena: Vorige keer perse vial nodig enzo haha",
"[23/09/2019, 10:04:23] Zeena: En nu maakt de dosering niet meer uit",
"[23/09/2019, 10:04:50] Remco: nja ej kan ook gewoon minder aflezen op de spuit",
"[23/09/2019, 10:04:54] Remco: ik heb geen idee met hoeveel water ik m",
"[23/09/2019, 10:04:59] Remco: mn mela uberhaupt gemengd hebt",
"[23/09/2019, 10:05:03] Zeena: O",
"[23/09/2019, 10:06:41] Zeena: Mja je weet dat ik dat wel liever wil weten ğŸ™",
"[23/09/2019, 10:06:57] Zeena: Maar opzich niet zo moeilijk want het is 10 mg dus als ik 1 ml erin doe is het 10m/ml",
"[23/09/2019, 10:07:03] Zeena: Dus ik snap m",
"[23/09/2019, 10:07:10] Zeena: Alleen geen idee hoeveel ik in mezelf spoot hahahaha",
"[23/09/2019, 10:19:40] Remco: 0,01ml is 100mcg dus",
"[23/09/2019, 10:19:58] Zeena: Je zou denken dat het dan best hard gaat zo'n vial",
"[23/09/2019, 10:20:15] Zeena: Ik denk dat we vorige keer wel gewoon 2 ml deden? Althans je wilde perse een andere vial hahah",
"[23/09/2019, 10:25:09] Remco: Hoezo",
"[23/09/2019, 10:25:15] Remco: Als je 0,01ml spuit",
"[23/09/2019, 10:25:27] Remco: Ja omdat 0,001 ml moeilijk is",
"[23/09/2019, 10:25:39] Zeena: Is 100x dus inderdaad",
"[23/09/2019, 10:25:42] Zeena: Dacht 10x haha",
"[23/09/2019, 10:25:50] Zeena: Ja True maar opzich kan ik nu wel hogere dosis wel",
"[23/09/2019, 10:26:00] Zeena: Begin wel op 0,01 en bouw op",
"[23/09/2019, 10:26:40] Remco: Ja dat is wel prima",
"[23/09/2019, 10:26:51] Remco: Ik doe 0,02/0,03",
"[23/09/2019, 10:27:11] Remco: maar weet niet hoeveel water ik heb gemengd",
"[23/09/2019, 10:27:17] Zeena: Ja begin wel even met 0,01 en kijk wel waarschijnlijk zit ik snel genoeg op 0,02 en 0,03 haha",
"[23/09/2019, 10:27:35] Zeena: Thanks iig had het moeilijker verwacht maar komt doordat vorige keer we het in een andere VIAL deden enzoğŸ˜‚",
"[23/09/2019, 10:29:55] Remco: En eerst ff paar keer met blauwe naald in de vial prikken",
"[23/09/2019, 10:30:04] Remco: Zodat wanneer je water in de spuit hebt het niet direct avcuum zuigt",
"[23/09/2019, 10:32:59] Zeena: Ahja goeie",
"[30/09/2019, 18:55:37] Remco: Je had het overigens trouwens wel door denk maar heb weinig zin om contact te houden via whapp",
"[30/09/2019, 18:56:31] Zeena: Doen we toch ook niet?",
"[30/09/2019, 18:57:17] Remco: Op sporadisch berichtjes hier en daar niet nee",
"[30/09/2019, 18:57:45] Zeena: Zoals â€˜t nu gaat is â€˜t prima toch?",
"[30/09/2019, 18:57:54] Zeena: Als ik wat nodig heb van jou stuur ik je een berichtje en andersom",
"[30/09/2019, 18:58:04] Zeena: Toch ğŸ˜¬",
"[30/09/2019, 18:59:24] Remco: Nah ik wil gewoon radiostilte",
"[30/09/2019, 19:00:04] Zeena: O oke dus dat ik jou vroeg om hoe ik de mela moest doen mocht niet  maar jij vragen stellen over flatex wel",
"[30/09/2019, 19:00:08] Zeena: ğŸ¥´",
"[30/09/2019, 19:00:32] Remco: Heb je afgelopen tijd een vraag gesteld en hoef ook niet meer te weten, mela is net als hcg en weten tig andere vrienden",
"[30/09/2019, 19:00:54] Zeena: Zo hey",
"[30/09/2019, 19:01:00] Zeena: Alsof ik dat wist?",
"[30/09/2019, 19:01:03] Zeena: Doe ff normaal joh",
"[30/09/2019, 19:01:18] Zeena: Jij kon ook rustig handleiding lezen lol",
"[30/09/2019, 19:01:18] Remco: Ik hoef gewoon geen contact meer met m'n ex, zo raar is dat toch niet?",
"[30/09/2019, 19:01:22] Zeena: Alsjeblieft zeg",
"[30/09/2019, 19:01:30] Zeena: Je praat echt bullshit, dat is het meer",
"[30/09/2019, 19:01:42] Zeena: Heb precies nergens meer iets gezegd tegen je alleen op mela na",
"[30/09/2019, 19:01:49] Zeena: Dit komt echt uit het nietsğŸ˜‚",
"[30/09/2019, 19:02:13] Remco: Klopt, en dat je flatex beleg ding gelukt was, maar ik zeg nu toch gewoon dat ik radiostilte wil",
"[30/09/2019, 19:02:44] Zeena: Dat was het ook",
"[30/09/2019, 19:02:49] Zeena: Dus daarom snap ik â€˜t niet",
"[30/09/2019, 19:02:58] Zeena: Voor mij was het al duidelijk",
"[30/09/2019, 19:03:00] Remco: Op die dingen na, dat is toch geen radiostilte?",
"[30/09/2019, 19:04:09] Zeena: Oke, was eigenlijk al duidelijk, maar bedankt voor nog meer duidelijkheid",
"[30/09/2019, 19:04:18] Zeena: Ik hoef geen duidelijkheid maar Daphne clearly wel",
"[05/10/2019, 19:05:39] Remco: Ik weet dat ik zei dat ik geen contact meer wil, maar volgens mij hoor ik mijn deel van Rob nog te krijgen, vanwaar heb je dat niet overgemaakt of even gezegd?",
"[05/10/2019, 19:06:51] Zeena: Tja, radiostilte is radiostilte toch? Wist niet zo goed wat ik nou wel of niet mocht doen. Straks word je bankrekening ook gecheckt en is het weer mijn schuld",
"[05/10/2019, 19:07:10] Zeena: Was van plan het op thunderdome nog te vragen aan je, aangezien we elkaar dan toch zullen zien",
"[05/10/2019, 19:08:09] Remco: Ah okÃ© duidelijk en enigszins begrijpbaar",
"[05/10/2019, 19:09:56] Zeena: Ook gezien ik niet echt zou weten wat ik in beschrijving zou moeten zetten, normaal doe ik iets van een ticket of sushi oid, maar dacht straks gaat het verkeerde ideeÃ«n opbrengen enzo en dat wilde ik niet",
"[05/10/2019, 19:10:09] Zeena: Wat wil je dat ik doe qua dat? Dan kan ik het zo overmaken",
"[05/10/2019, 19:23:02] Remco: Yes I get it, doe maar ADE",
"[05/10/2019, 19:23:34] Remco: Wat ik nog even wou zeggen is dat ik nu gewoon met Daphne ben, en jij met Quinten en daar moeten we gewoon vrede mee hebben. En niet van dat gezeik zoals na Thuishaven, want het gaat nou eenmaal voorkomen dat mijn vriendin of jouw vriend w/e bij onze gezamenlijke vrienden staan op feestjes. Dat quinten bij leon/vince etc stond op Smeerboel maakt mij echt totaal niet uit, laat hem er lekker bij komen en het zelfde geldt voor Daphne imo. Straks op Thunderdome gaat dat ook voorkomen als Daphne en Quinten gaan, dus laten we gewoon volwassen zijn en na de tijd niet gaan ruzien over dat persoon X bij onze vrienden groep staat",
"",
"En dan wou ik nog even een klein stukje over Daphne zeggen, radiostilte etc komt niet alleen van haar maar ook gewoon vanaf mij. Zij heeft wat problemen met vertrouwen door de dingen die gewoon in het verleden zijn gebeurt tussen ons wat heel logisch is. Maar ben er ook over eens wat wij gezamenlijke vrienden/whappgroepen hebben prima is maar het daar ook gewoon bij moet blijven",
"[05/10/2019, 19:24:26] Remco: Hoop dat je het eens bent daarover",
"[05/10/2019, 19:25:00] Zeena: Ja I get it, dat met thuishaven was gewoon zo out of nowhere en  houd wel in je hoofd dat ik toen nog niet aan het daten was he ğŸ˜› dus im way past that nu",
"[05/10/2019, 19:25:26] Zeena: Out of nowhere als in had het niet gehoord dus vond het een kutte manier om er zo achter â€˜t ekomen",
"[05/10/2019, 19:25:34] Zeena: Maar goed all is well nu",
"[05/10/2019, 19:25:53] Zeena: Ben het er mee eens hoor",
"[05/10/2019, 19:27:29] Remco: Voelde gewoon niet de drang of zag niet in waarom ik specifiek destijds tegen jou had moeten vertellen/verantwoorden dat Daphne mee ging naar Thuishaven. Maar goed dat we het er over eens zijn en dan vanaf hier (niet dat we dat nog hadden maar goed) geen gezeik meer over onze persoonlijke keuzes",
"[05/10/2019, 19:28:31] Zeena: ğŸ‘ğŸ¼",
"[05/10/2019, 19:28:46] Zeena: Hopelijk no hard feelings verder? We good?",
"[05/10/2019, 19:29:06] Zeena: Heb het gevoel dat je boos op me bent maar dat is het laatste wat ik wil ğŸ˜‚ğŸ˜¬",
"[05/10/2019, 19:48:15] Remco: Nee ben niet boos behalve dat van Thuishaven vond ik wel gewoon kut omdat je na domi zei dat je Daphne een aardige meid vond en geen problemen mee had om haar daar te zien, en dat ze ook bij onze vrienden stond maar dan vervolgens wel mij/haar afbranden via whatsapp, dus kwam beetje over alsof heel Dominator schone schijn was, terwijl het vice versa nu ook gebeurt. Plus dat je een aantal keer hebt gezegd dat zij niks voor mij is, alsof je mij probeert over te halen om met haar te stoppen zodat jij het niet meer zou zien",
"[05/10/2019, 19:50:05] Zeena: Nou ik heb je al paar keer gezegd dat wat ik bedoelde met thuishaven niet is hoe jij het hebt opgepakt.. dat ik bedoelde dat ik gewoon niet wil dat ze in onze whatsapp groep komt, niet onze vriendengroep want dat gebeurt sowieso wel",
"[05/10/2019, 19:51:18] Zeena: Want verder vind ik haar inderdaad gewoon aardig",
"[05/10/2019, 19:53:05] Zeena: En dat je vaak genoeg hebt benadrukt dat het niet je gf is ğŸ¤”",
"[05/10/2019, 19:53:43] Zeena: Mja, maakt niet uit allemaal meer. Maar hoop niet dat door deze miscommunicatie onze vriendschap nu minder is geworden en Daphne nu heel anders over mij denkt",
"[05/10/2019, 19:54:48] Zeena: En je weet dondersgoed dat ik onder invloed gewoon eerlijk ben dus dat met dominator was sowieso geen schijnğŸ˜‚ğŸ™„",
"[05/10/2019, 20:29:10] Remco: Omdat ik destijds met haar nog nooit besproken heb over een relatie dus kon haar ook gewoon niet officieel niet m'n gf noemen",
"[05/10/2019, 20:30:25] Remco: Van mij part niet, maar ik blijf wel bij dat ik gewoon ff radiostilte wil. En om heel eerlijk te zijn vond daphne je ook eaardig maar dat met Thuishaven heeft wel echt zure nasmaak gegeven, ook wel vaker voor haar gevoel dat er al wat feestjes zijn verpest door gekanker tussen ons. Zo bijvoorbeeld op intents toen met die 2cb. Eigenlijk zo erg dat ze geen thunderdome wilt omdat ze geen schijn wilt ophouden",
"[05/10/2019, 20:32:49] Zeena: Maar heb je ook verteld dat ik het anders bedoelde met Thuishaven dan? Dat ik zei dat ik haar niet bij de groep wilde zou ik wel begrijpen dat ze kut vindt om te horen, maar ik bedoelde dus alleen whatsapp groep? Dus weet niet of je dat nog hebt verteld",
"[05/10/2019, 20:33:18] Zeena: De rest snap ik ook wel, al is intents het enige geweest waar ik inderdaad zelf ook mee heb gespeeld, de andere feesten niet meer eigenlijk",
"[05/10/2019, 20:34:06] Zeena: En dat ze niet naar thunderdome wil gaan is haar eigen keuze dan, al denk ik dat het geen slimme zet is persoonlijk. Lijkt me juist perfecte gelegenheid om het evt te kunnen oplossen als echt volwassenen, mocht het ter sprake komen oid",
"[05/10/2019, 20:34:27] Zeena: Ik hoop dat je mij begrijpt",
"[05/10/2019, 20:51:03] Remco: Heb het net vertelt ja en ik begrijp je wel, maar er zijn voor haar nog veel meer andere ergernissen geweest",
"[05/10/2019, 20:51:15] Remco: Elke keer als ik ruzie met haar heb is het omdat wij iets hadden gedaan",
"[05/10/2019, 20:52:46] Remco: Ik heb ook al gewoon gezegd dat quinten thunderdome gaat dus zij daar geen last van zal hebben, aangezien ze het gevoel had op dominator dat jij constant om mij heen hing, en dat zij niet tussen ons in kon komen wanneer ze wat wou vertellen ofzo",
"[05/10/2019, 20:56:20] Zeena: Ja geloof ik best. Maar is wel echt tot een maandje terug allemaal lijkt me, of zelfs iets langer geleden dan dat? Idk man voor mijn gevoel heb ik je zolang niet meer gesproken en gezien dat ik denk van wat gebeurt er allemaal en waarom gaat dit nog steeds door haha",
"[05/10/2019, 20:56:57] Zeena: Ja eerste zal sowieso wel zo zijn denk, tweede weet ik niet zo goed want jullie waren sowieso laat aangekomen en ik probeerde ook met haar te praten en zover ik weet was ik maar paar uurtjes met julllie haha",
"[05/10/2019, 20:59:25] Zeena: Maar goed weetje, ik kan het niet goedpraten",
"[05/10/2019, 20:59:35] Zeena: Het zal allemaal wel beter gaan in de loop van tijd denk ik",
"[05/10/2019, 20:59:51] Zeena: Althans, hoop ik, want ik wil ook gewoon dat het leuk is tussen ons en mij en Daphne",
"[05/10/2019, 20:59:59] Zeena: Vind het wel serieus jammer dat het zo is gegaan",
"[05/10/2019, 21:11:13] Remco: Omdat zij mij gewoon fucking wantrouwt door alles wat gebeurt is, ze vertrouwd mij niet en jou niet",
"[05/10/2019, 21:11:37] Remco: En hoe je het went of keert, op feesten hang jij altijd bij iedereen om de hals en zo ook bij mij. Zij pakt dat gewoon niet op op een goeie manier en zoekt daar wat achter",
"[05/10/2019, 21:11:50] Remco: Betwijfel of het goed komt mja",
"[05/10/2019, 21:13:27] Zeena: Heeft tijd en ruimte nodig",
"[05/10/2019, 21:46:36] Remco: I guess so",
"â€[27/10/2019, 06:13:51] Remco: â€<attached: 00568309-PHOTO-2019-10-27-06-13-51.jpg>",
"â€[27/10/2019, 06:13:52] Remco: â€<attached: 00568310-PHOTO-2019-10-27-06-13-51.jpg>",
"â€[27/10/2019, 06:13:52] Remco: â€<attached: 00568311-PHOTO-2019-10-27-06-13-52.jpg>",
"â€[27/10/2019, 06:13:53] Remco: â€<attached: 00568312-PHOTO-2019-10-27-06-13-52.jpg>",
"â€[27/10/2019, 06:13:53] Remco: â€<attached: 00568313-PHOTO-2019-10-27-06-13-53.jpg>",
"â€[27/10/2019, 06:16:01] Remco: â€<attached: 00568314-PHOTO-2019-10-27-06-16-00.jpg>",
"â€[27/10/2019, 07:39:45] Zeena: â€<attached: 00568315-VIDEO-2019-10-27-07-39-45.mp4>",
"â€[28/10/2019, 19:05:36] Zeena: â€<attached: 00568376-PHOTO-2019-10-28-19-05-36.jpg>",
"[28/10/2019, 19:51:54] Remco: Wtf is haar probleem",
"[28/10/2019, 19:54:07] Zeena: Hahaha weetnie maar goed dacht ik laat â€˜t je zien zodat je weet dat ik niet degene ben die stookt maar dat â€˜t echt door haar komt",
"[28/10/2019, 20:00:41] Remco: Fucking achterlijk en is niet de eerste keer, ga moi vragen of zij een probleem heeft",
"[28/10/2019, 20:05:57] Zeena: Zolang je mij er niet bij betrekt want dan is â€˜t weer mijn schuld ğŸ˜’",
"[28/10/2019, 20:06:10] Zeena: Weer een vriendschap die ik dan moet fixen ğŸ¤ª",
"[28/10/2019, 20:08:14] Remco: Mja is toch lullig dat ze zulke shit achter m'n rug om doet terwijl zij er niks mee te maken heeft, en dan wel leuk vraagt met dominator mag ik met jou en daphne mee rijden. En hoe vaak zie je haar nou, die vriendschap stelt ook niks voor en wss lult ze dan ook wel achter jouw rug zoals vroeger. Die twee voorbeelden van fb lach emoji en tags heb jij niks mee te maken, maar idk hoe ik het anders moet brengen zonder jou er bij te betrekken",
"[28/10/2019, 20:09:31] Zeena: Zeg â€˜t gewoon volgende keer als je haar ziet ğŸ¤·ğŸ»â€â™€ en dan alleen die twee dingen en niet dit perse",
"[28/10/2019, 20:09:46] Zeena: Laten we dit zien als een soort bevestigend iets ofzo",
"[28/10/2019, 20:11:30] Remco: Kan je haar niet vragen wrm ze stuurt of zo doet",
"[28/10/2019, 20:13:29] Zeena: ğŸ™„",
"[28/10/2019, 20:14:01] Zeena: Ik zei nog tegen Daphne dat ik nog steeds alles voor je zou doen ondanks dat we niet meer samen zijn",
"[28/10/2019, 20:14:06] Zeena: Vooruit ğŸ˜’",
"â€[28/10/2019, 21:37:03] Zeena: â€<attached: 00568475-PHOTO-2019-10-28-21-37-03.jpg>",
"[28/10/2019, 21:37:11] Zeena: Word je niet wijzer van denk ik",
"[28/10/2019, 21:37:17] Zeena: Maar goed",
"[28/10/2019, 21:37:30] Zeena: Laat gaan ğŸ˜¬",
"[28/10/2019, 21:38:21] Remco: Hmm naja zal wel dan",
"[12/11/2019, 09:49:12] Zeena: https://www.ing.nl/particulier/betaalverzoek/index.html?trxid=2lzsI8r7yootuyRfzI1DoBIwTEXAQ7zo",
"[12/11/2019, 09:51:36] Remco: Betaald thx",
"[12/11/2019, 09:51:40] Remco: Laat maar weten wanneer verstuurt is",
"[12/11/2019, 10:45:20] Zeena: Doe ikğŸ¤—",
"[12/11/2019, 11:55:11] Remco: Denk je dat je vandaag kan sturen nog?",
"[12/11/2019, 11:55:32] Remco: Zodat ik het woensdag heb",
"[12/11/2019, 11:59:49] Zeena: Nee ik werk tot 5 dus dan lukt â€˜t niet meer",
"[12/11/2019, 11:59:59] Zeena: Misschien in de avond nog maar dan alsnog heb je â€˜t donderdag pas",
"[12/11/2019, 12:00:17] Zeena: Moet ik â€˜t anders naar Daphne sturen? Weetnie of â€˜t beter is",
"[12/11/2019, 12:02:16] Remco: Ah ja nah doe dan maar gewoon spar I guess",
"[12/11/2019, 12:03:58] Zeena: Okido",
"[12/11/2019, 12:26:27] Remco: Zou je naar Groningen pakket punt willen sturen?",
"[12/11/2019, 12:30:27] Zeena: Mogelijk",
"[12/11/2019, 12:30:34] Zeena: Wat is het adres",
"[12/11/2019, 12:30:46] Zeena: Dan kijk ik welke dichtstbijzijnde is en of dat ok is",
"[12/11/2019, 12:49:51] Remco: Yeah heb gevraagd",
"â€[12/11/2019, 13:06:55] Remco: â€<attached: 00568572-PHOTO-2019-11-12-13-06-55.jpg>",
"[12/11/2019, 13:07:12] Zeena: En wat is Daphne haar adres",
"[12/11/2019, 13:07:35] Zeena: Want dat moet ik ook invullen",
"[12/11/2019, 13:29:11] Remco: Kan je niet gewoon mijn adres invullen?",
"[12/11/2019, 13:31:38] Zeena: Ja, maar dan moet ze, als ze het ophaalt, hoogstwaarschijnlijk het adres+nr ook aangeven van waar het pakket naar geadresseerd is voor bevestiging",
"[12/11/2019, 13:32:16] Zeena: Maakt mij verder niet uit",
"[12/11/2019, 13:36:14] Remco: Ah ja",
"[12/11/2019, 13:36:16] Remco: Doe dat maar",
"[12/11/2019, 13:38:29] Zeena: Durf je adres niet te geven ofwat? ğŸ˜‚",
"[12/11/2019, 13:40:27] Remco: Zij wilt dat niet",
"[12/11/2019, 13:41:52] Zeena: Apart maar oke",
"[13/11/2019, 13:38:50] Zeena: Moet ik het op Daphneâ€™s naam zetten of jouwe?",
"[13/11/2019, 13:39:20] Remco: Daphne met mijn adres",
"[13/11/2019, 13:39:50] Zeena: OkÃ©",
"â€[13/11/2019, 15:51:41] Zeena: â€<attached: 00568586-PHOTO-2019-11-13-15-51-41.jpg>",
"[13/11/2019, 15:51:47] Zeena: Als â€˜t goed is heb je ook mail gekregen",
"[13/11/2019, 15:53:01] Remco: Yes ik zie het",
"[13/11/2019, 15:53:03] Remco: Danku",
"[16/02/2020, 01:17:02] Zeena: Wij gaan progressive linksvoor",
"[16/02/2020, 01:17:15] Remco: Ja ik welp",
"[16/02/2020, 01:17:21] Remco: Waar moet ik komen",
"[16/02/2020, 01:17:27] Zeena: Progressive linksvoor",
"[16/02/2020, 01:17:45] Remco: Daar ben ik",
"[16/02/2020, 01:17:51] Zeena: OkÃ© we komen eraan",
"[16/02/2020, 01:18:28] Remco: Vage shity moeilijk trippen hier",
"[16/02/2020, 01:18:55] Zeena: Komen eraan",
"[16/02/2020, 03:19:47] Zeena: Waar zijn jullie?",
"[16/02/2020, 03:31:03] Remco: Buiten de 138",
"[16/02/2020, 03:31:06] Remco: Op bankjes",
"[16/02/2020, 03:33:18] Zeena: Oke komen eraan",
"[16/02/2020, 03:36:05] Remco: Film deze",
"[16/02/2020, 04:16:53] Zeena: Zijn jullie psy of progressive?",
"[16/02/2020, 04:17:02] Remco: Ik ging wc",
"[16/02/2020, 04:17:06] Remco: Nu ben ik de rest zoeken",
"[16/02/2020, 04:17:11] Remco: Heb al rondjes psy gedaan maar zie niemand",
"[16/02/2020, 04:17:14] Remco: Echt geen idee",
"[16/02/2020, 04:17:20] Zeena: Ik ben psy lonksvoor",
"[16/02/2020, 04:17:36] Zeena: Kom je",
"[16/02/2020, 04:17:39] Zeena: Of is dat ver voor je?",
"[16/02/2020, 04:17:41] Remco: Ja",
"[16/02/2020, 04:17:48] Remco: Kom er aa",
"[16/02/2020, 10:40:57] Remco: Heb je nog fotoâ€™s",
"â€[16/02/2020, 11:51:59] Zeena: â€<attached: 00568614-PHOTO-2020-02-16-11-51-59.jpg>",
"â€[16/02/2020, 11:51:59] Zeena: â€<attached: 00568615-PHOTO-2020-02-16-11-51-59.jpg>",
"â€[16/02/2020, 11:52:00] Zeena: â€<attached: 00568616-PHOTO-2020-02-16-11-52-00.jpg>",
"â€[16/02/2020, 11:52:01] Zeena: â€<attached: 00568617-PHOTO-2020-02-16-11-52-01.jpg>",
"â€[16/02/2020, 11:52:01] Zeena: â€<attached: 00568618-PHOTO-2020-02-16-11-52-01.jpg>",
"â€[16/02/2020, 11:52:02] Zeena: â€<attached: 00568619-PHOTO-2020-02-16-11-52-02.jpg>",
"â€[16/02/2020, 11:52:02] Zeena: â€<attached: 00568620-PHOTO-2020-02-16-11-52-02.jpg>",
"â€[16/02/2020, 11:52:03] Zeena: â€<attached: 00568621-PHOTO-2020-02-16-11-52-03.jpg>",
"â€[16/02/2020, 11:52:03] Zeena: â€<attached: 00568622-PHOTO-2020-02-16-11-52-03.jpg>",
"â€[16/02/2020, 14:13:22] Zeena: â€<attached: 00568623-PHOTO-2020-02-16-14-13-22.jpg>",
"[16/02/2020, 15:44:12] Remco: Die classics ja",
"[16/02/2020, 15:44:17] Remco: Straks ff luisteren",
"[16/02/2020, 15:49:17] Zeena: Jaa",
"[16/02/2020, 15:49:32] Zeena: Volgens mij had Daphne ook gefilmd",
"[16/02/2020, 15:49:35] Zeena: Zou je die kunnen doorsturen",
"[16/02/2020, 15:50:16] Remco: Ik zal straks ff vragen",
"[16/02/2020, 15:50:21] Remco: Ze slaapt",
"[16/02/2020, 15:50:55] Zeena: Cute",
"[16/02/2020, 15:51:01] Zeena: Heb jij nog kunnen slapen?",
"[16/02/2020, 15:51:12] Zeena: Hoe was jullie treinreis verder?",
"[16/02/2020, 15:55:38] Remco: Nee heb nog niet geslapen maar wel ff op bed gelegen",
"[16/02/2020, 15:56:36] Remco: Vlekkeloos gelukkig, zijn om 5;15 ofoz ook weg gegaan, hadden het wel gezien",
"[16/02/2020, 15:57:54] Zeena: Ja als je vanaf het begin al daar bent was het wel genoeg geweest imo",
"[16/02/2020, 15:58:05] Zeena: Waren ook niet denderende artiesten verder dus niet zo boeiend",
"â€[16/02/2020, 16:06:49] Remco: â€<attached: 00568639-VIDEO-2020-02-16-16-06-49.mp4>",
"[16/02/2020, 16:07:00] Remco: Jep waren al binnn voordat muziek aan ging lol",
"[16/02/2020, 16:25:17] Zeena: Thanksss. Echt mooi was deze ğŸ˜",
"[16/02/2020, 16:25:27] Zeena: Volgens mij ook een van de weinige liedjes die ik kende vannacht lolğŸ˜…",
"[16/02/2020, 16:25:34] Zeena: Heftig hahaha",
"[01/03/2020, 14:39:45] Remco: Hoi, volgens Daphne heb ik in de week na Kings of core(februari) g bij jou opgehaald. Ik kan me er niks van herinneren, is dat zo?",
"[01/03/2020, 14:42:53] Zeena: Dit jaar?",
"[01/03/2020, 14:43:45] Remco: Ja blijkbaar. Ik heb een keertje een paar maanden later met jou ik Zwolle mâ€™n drugs enzo uitgewisseld en heb laatst een keer g gekregen van je, maar weet niks van februari en g",
"[01/03/2020, 14:44:42] Zeena: Laatste keer had ik het opgestuurd naar Daphne haar adres wat naar jou thuis was gestuurd",
"[01/03/2020, 14:44:55] Zeena: Heb daarna zelf ook geen g meer besteld",
"[01/03/2020, 14:45:08] Zeena: Dat was eind vorig jaar nog ergens",
"[01/03/2020, 14:47:28] Remco: Alright nou thanks, heb het haar laten lezen. Vage bedoeling maar zal wel",
"[01/03/2020, 14:52:25] Remco: Daphne wil ook nog weten of ik bij jou ben geweest",
"[01/03/2020, 15:03:13] Zeena: Nee kan me de laatste keee niet eens herinneren",
"[01/03/2020, 15:03:22] Zeena: Denk asot vorig jaar",
"[01/03/2020, 15:03:25] Zeena: ğŸ¤”",
"[01/03/2020, 15:04:03] Zeena: En sowieso heb je niks te zoeken bij mij lol ğŸ¤£",
"[01/03/2020, 15:08:25] Remco: Nou thanks voor de bevestiging",
"[01/03/2020, 15:08:27] Remco: Appreciate it",
"[03/12/2020, 00:10:47] Zeena: Gefeliciteerd met je verjaardag grote jongen ğŸ¥³",
"[03/12/2020, 00:15:55] Remco: Hahahha, thanks Zeena",
"[03/12/2021, 09:41:11] Zeena: Gefeliciteerd met je verjaardag ğŸ¤—",
"[03/12/2021, 12:49:11] Remco: Danku â˜ºï¸"]}
